Time,Content
2021-10-27,航发动力：第三季度净利3.22亿元 同比增42.91%
2021-10-27,航发动力(600893.SH)：第三季度净利增42.91%至3.22亿元
2021-10-12,航发动力(600893.SH)：拟向西航公司受让3宗土地及地上资产
2021-10-12,航发动力(600893.SH)：拟对吉发公司实施破产清算
2021-10-11,航发动力、中航机电、爱乐达涨超5%，军工ETF（512660）涨超3%
2021-09-17,航发动力：本次限售股上市日为9月27日 占公司总股本8.51%
2021-09-16,航发动力(600893.SH)：2.21亿股限售股及28.8万股股改限售股将于9月27日解禁上市
2021-09-07,航发动力(600893.SH)：航空工业集团拟将所持6.6%股份无偿划转给中国航发
2021-09-07,航发动力(600893.SH)：控股股东将变更为中国航发
2021-08-27,航发动力2021年半年度净利4.61亿元 同比净利增加12.94%
2021-08-27,航发动力(600893.SH)：上半年净利增12.94%至4.61亿元
2021-07-28,航发动力(600893.SH)：“工程与管理数据中心建设项目”已通过竣工验收
2021-07-19,航发动力进行大额现金管理 印证航空产业高景气（附股）
2021-07-16,军工板块拉升走强 航发动力逼近涨停
2021-06-16,航发动力(600893.SH)：2020年度权益分派10派1.3元 股权登记日6月22日
2021-06-09,航发动力：与中国航发集团财务有限公司重新签订《金融服务协议》暨关联交易
2021-05-31,大洋生物：公司的氟化工精细化学品未应用到C919大飞机制造截止目前 航发动力、中航高科不是公司客户
2021-05-25,航发动力：公司2020年航空发动机及衍生品产量为222.99亿元 销量为222.90亿元
2021-05-25,军工板块走强 航发动力(600893.SH)涨停
2021-04-30,A股异动 | 航发动力(600893.SH)跌7.7% 一季度净利同比下降60.09%
2021-04-08,航发动力：公司编制了十四五发展规划 包括技术发展规划等
2021-04-08,航发动力：三代中等推力航空发动机项目已经验收并进行批量生产
2021-04-08,航发动力：航发科技和航发控制均属于公司实际控制人中国航发下属的上市公司
2021-04-08,航发动力：公司主要产品和服务有航空发动机及燃气轮机整机、部件 维修保障服务等
2021-03-31,航发动力2020年净利增长6.37%：高管薪酬1008万元
2021-03-31,【龙虎榜】航发动力3月31日成交明细
2021-03-30,航发动力(600893.SH)2020年净利升6.37%至11.46亿元 拟10派1.3元
2021-03-30,航发动力：2020年净利11.46亿元 同比增6%
2021-03-30,航发动力年度报告：2020年度净利同比同比增长6.37% 拟10派1.3元
2021-03-09,【龙虎榜】航发动力3月9日成交明细
2021-03-09,航发动力跌9.5% 1月高点招商证券发研报强烈推荐
2021-03-09,埋伏资金出逃，军工再遭重挫，两日暴跌10%！中航西飞、航发动力领跌
2021-03-08,【龙虎榜】航发动力3月8日成交明细
2021-02-25,航发动力(600893.SH)：下属子公司拟减持中航资本2226.189万股股票
2021-02-08,航发动力(600893.SH)：“三代中等推力航空发动机生产线建设项目”已通过竣工验收
2021-01-14,航发动力跌停 两天前招商证券发研报强烈推荐
2021-01-04,【龙虎榜】航发动力1月4日成交明细
2021-01-04,航发动力(600893.SH)：股价连续3个交易日内日收盘价格涨幅偏离值累计超过20%
2020-12-29,航发动力(600893.SH)下属子公司拟开展无追索权应收账款保理业务
2020-11-30,航发动力：公司目前参与了C919在研发动机配套零部件产品的生产
2020-11-17,宗申动力：目前宗申航发公司的航空动力主要应用于无人机
2020-11-06,[航发动力]公司承办中国航发第二届名师带徒培训项目开班
2020-10-30,航发动力前三季度净利6.34亿增长53.3% 收到被投资企业分红款
2020-10-30,航发动力：2020年前三季度主要财务指标
2020-10-29,航发动力(600893.SH)前三季度净利润升53.30%至6.34亿元
2020-09-28,航发动力(600893.SH)2020年累计收到1.02亿元政府补助
2020-09-15,航发动力：2020年第四次临时股东大会决议公告
2020-08-25,航发动力2020年上半年净利4.08亿增长26.52% 本期期间费用减少
2020-08-25,航发动力上半年净利同比增长26%
2020-08-25,午后军工股持续下挫 洪都航空、航发动力跌停
2020-08-07,【龙虎榜】航发动力8月7日成交明细
2020-07-09,【龙虎榜】航发动力7月9日成交明细
2020-06-10,航发动力重组事项获证监会核准批复
2020-05-09,航发动力股东航空工业集团减持2812.29万股 套现约6.53亿元
2020-05-08,航发动力：重组上会 11日起停牌
2020-04-28,航发动力：2020年第一季度主要财务指标
2020-04-27,航发动力第一季度盈利8623.21万同比增长2106.25% 财务费用减少
2020-04-18,航发动力：2019年年度主要财务指标
2020-04-18,航发动力：关于召开2019年年度股东大会的通知
2020-04-18,航发动力：第九届董事会第二十六次会议决议公告
2020-04-17,航发动力：2019年净利同比增长1.27％ 拟10派1.44元
2020-04-03,[航发动力]公司部署2020年精神文明建设工作
2020-03-28,航发动力：关于召开2020年第三次临时股东大会的通知
2020-03-28,航发动力：第九届董事会第二十五次会议决议公告
2020-03-20,航发动力：第九届董事会第二十四次会议决议公告
2020-02-20,航发动力：发行股份购买资产获中国航发批复
2020-02-20,航发动力：发行股份购买资产事项获中国航发批复
2020-01-23,航发动力：2020年第一次临时股东大会决议公告
2020-01-16,航发动力使用闲置自有资金50亿元进行现金管理
2020-01-14,航发动力好手段：84.9亿元全资并购3家子公司债转股降负65亿元
2020-01-13,航发动力：关于召开2020年第二次临时股东大会的通知
2020-01-13,航发动力：第九届董事会第二十二次会议决议公告
2020-01-03,航发动力：关于召开2020年第一次临时股东大会的通知
2020-01-03,航发动力：第九届董事会第二十一次会议决议公告
2020-01-03,航发动力拟对下属子公司提供2.34亿元担保
2020-01-02,航发动力子公司参股公司在香港联合交易所挂牌上市
2019-11-07,航发动力：股东终止认购证券投资基金 拟减持不超1.25%股份
2019-11-07,航发动力：股东终止认购证券投资基金 拟减持股份
2019-10-30,航发动力前三季度盈利4.13亿 同比下滑36.47%
2019-10-30,航发动力：2019年前三季度主要财务指标
2019-10-30,航发动力：第九届董事会第十九次会议决议公告
2019-10-16,"[航发动力]李胜泉:以生命赴使命,用热血写忠诚"
2019-09-13,航发动力：2019年第四次临时股东大会决议公告
2019-08-23,航发动力：2019年半年度主要财务指标
2019-08-23,航发动力：第九届董事会第十八次会议决议公告
2019-08-23,航发动力：关于召开2019年第四次临时股东大会的通知
2019-08-23,航发动力2019年上半年盈利3.2亿 航空发动机及衍生产品收入同比增加
2019-08-06,航发动力：2019年第三次临时股东大会决议公告
2019-07-22,65亿元债转股预案出台 航发动力拟增资3家子公司
2019-07-20,航发动力：关于召开2019年第三次临时股东大会的通知
2019-07-20,航发动力：关于披露发行股份购买资产暨关联交易预案暨公司股票复牌的提示性公告
2019-07-20,航发动力：第九届董事会第十七次会议决议公告
2019-07-19,航发动力：重组拟收购黎明公司、黎阳动力、南方公司股权
2019-07-19,航发动力拟收三家公司股权 22日开市起复牌
2019-07-13,航发动力：关于筹划债转股和发行股份购买资产事项停牌进展及延期复牌公告
2019-07-09,航发动力将获国资基金支持 军工资产证券化有望加速(附股)
2019-07-09,航发动力：关于筹划债转股和发行股份购买资产事宜的停牌公告
2019-07-08,航发动力筹划债转股及发行股份 欲改善旗3家子公司资产负债状况
2019-07-08,航发动力：停牌系筹划债转股和发行股份购买资产事宜
2019-07-08,航发动力：筹划债转股和发行股份购买资产事宜 股票停牌
2019-07-08,航发动力：筹划债转股和发行股份购买资产事宜
2019-06-14,[航发动力]中国航发规划工作研讨会在公司召开
2019-06-04,航发动力：股东航空工业集团拟以不超1.25%股份换购基金份额
2019-06-04,航发动力：股东拟以不超1.25%公司股份换购基金份额
2019-05-24,航发动力：2018年年度权益分派实施公告
2019-05-18,航发动力：第九届董事会第十六次会议决议公告
2019-05-18,航发动力：关于召开2019年第二次临时股东大会的通知
2019-05-04,航发动力一季度净利391万元 现金流量净额为-7.86亿元
2019-04-20,航发动力：2018年年度股东大会决议公告
2019-04-04,[苏州高新]东菱公司“航空动力装备动力学性能试验技术”项目荣获湖南省技术发明奖二等奖
2019-03-29,航发动力：2018年年度主要财务指标
2019-03-29,航发动力：关于召开2018年年度股东大会的通知
2019-03-29,航发动力：第九届董事会第十四次会议决议公告
2019-01-25,航发动力：2019年第一次临时股东大会决议公告
2019-01-04,航发动力：关于召开2019年第一次临时股东大会的通知
2019-01-04,航发动力：第九届董事会第十三次会议决议公告
2018-12-29,航发动力：第九届董事会第十二次会议决议公告
2018-12-19,航发动力：第九届董事会第十一次会议决议公告
2018-12-10,[海特高新]海特高新获批组建“四川省航空动力控制系统工程技术研究中心”
2018-12-08,航发动力：2018年第七次临时股东大会决议公告
2018-11-19,航发动力：2018年第六次临时股东大会决议公告
2018-11-19,航发动力：关于召开2018年第七次临时股东大会的通知
2018-11-19,航发动力：第九届董事会第十次会议决议公告
2018-10-30,航发动力：关于召开2018年第六次临时股东大会的通知
2018-10-30,航发动力：第九届董事会第九次会议决议公告
2018-10-30,航发动力：2018年前三季度主要财务指标
2018-09-28,航发动力：拟挂牌转让铝业公司70.935%股权
2018-09-27,航发动力：第九届董事会第八次会议决议公告
2018-09-19,航发动力发力混改 打造“军民融合”示范企业
2018-09-14,航发动力：第九届董事会第七次会议决议公告
2018-09-14,航发动力：2018年第五次临时股东大会决议公告
2018-09-03,与赛峰合作12年后拟出清赛峰贵阳股权 航发动力：主要是市场因素
2018-09-03,航发动力：航发主业增长稳定，经营效率稳步提升
2018-09-03,航发动力：中报业绩高速增长 看好公司长期发展
2018-08-31,航发动力：聚焦主业交付提速 优化费用业绩大增
2018-08-29,聚焦航空发动机主业 航发动力上半年净利大增
2018-07-10,航发动力实控人拟增持 多重机遇推动业绩增长
2018-07-05,航发动力：参与C919大飞机国产发动机项目
2018-07-02,航发动力：实控人拟斥资1亿至2亿元增持
2018-07-02,航发动力：实控人拟继续增持公司股份不超过2亿元
2018-06-15,山河智能：与宗申动力在通用航空动力领域开展合作
2018-06-14,[钢研高纳]钢研高纳董事长艾磊一行走访中国航发贵州黎阳航空动力有限公司
2018-06-08,航发动力：2017年年度权益分派实施公告
2018-05-30,航发动力：2018年第四次临时股东大会决议公告
2018-05-17,航发动力：募投项目已竣工并获省发改委验收批复
2018-05-14,航发动力：第九届董事会第四次会议决议公告
2018-05-14,航发动力：2018年第三次临时股东大会决议公告
2018-05-14,航发动力：关于召开2018年第四次临时股东大会的通知
2018-05-09,航发动力议案变卦 标的未实现预期目标
2018-05-09,航发动力：第九届董事会第三次会议决议公告
2018-04-27,航发动力：2018年第一季度主要财务指标
2018-04-27,航发动力：第九届董事会第二次会议决议公告
2018-04-27,航发动力：关于召开2018年第三次临时股东大会的通知
2018-04-21,航发动力：2017年年度股东大会决议公告
2018-04-03,航发动力：稳健增长 厚积薄发
2018-03-30,中科航空动力抢滩中小型航空发动机研发
2018-02-13,航发动力：2018年第二次临时股东大会决议公告
2018-01-26,航发动力：第八届董事会第三十次会议决议公告
2017-12-27,减资退出亏损子公司 航发动力回归主业
2017-12-26,减资退出亏损子公司 航发动力回归主业加速
2017-10-09,航发动力：2017年第三次临时股东大会决议公告
2017-10-09,航发动力：第八届董事会第二十五次会议决议公告
2017-08-29,航发动力：2017年半年度主要财务指标
2017-07-07,航发动力：上半年净利预增80%-92%
2017-06-06,航发动力：实控人拟增持3000万元-1亿元
2017-06-06,上证50个股走强 航发动力涨近5%
2017-06-02,航发动力：第八届董事会第二十二次会议决议公告
2016-12-22,中航动力股东中国华融累计减持2892万股 占比1.48％
2016-11-09,中航动力拟非公开发行募资100亿元 66亿元偿还贷款
2016-03-28,瑞风协同子公司中标中航动力研究所项目
2016-03-03,中国航发成为中航动力实际控制人
2016-03-02,成发科技与中航动力实控人变更
2015-10-14,中航动力等三公司重组踏出第一步 五股或炒作(附股)
2015-09-30,中航工业航空发动机资产重组 中航动力8日起停牌
2015-07-19,宁福顺：中国不能没有中航动力
2015-07-18,宁福顺：中国不能没有中航动力
2015-01-13,中航动力重组完成 年度业绩大幅预增
2014-12-10,中航动力:第六届董事会第十八次会议决议公告
2014-06-12,军工航天板块走强 航空动力涨逾6%
2014-05-15,航空动力重大资产重组事宜获得证监会核准
2013-10-16,航空动力前三季营收50亿 净利超2亿
2013-08-15,航空动力中期净利超1亿 增近三成
2013-06-21,借重组预期近两亿游资热炒航空动力
2013-06-19,航空动力还有资产整合空间
2013-06-18,航空动力：航空发动机巨无霸浮出水面
2013-06-18,航空航天板块集体大涨 航空动力涨停
2013-06-18,航空航天板块早盘集体大涨 航空动力涨停
2013-06-18,航空动力拟95亿元购航空发动机资产
2013-03-31,航空动力重大重组方案初步确定 延期复牌
2013-02-26,航空动力：重组初定中航工业注入航空发动机主机制造
2012-09-18,航空动力:中报下滑不影响全年稳定增长
2012-08-09,航空动力上半年净利9752万 同比降17%
2011-09-23,航空动力：签订长期采购协议
2011-07-26,航空动力：航空工业之花蓄势起飞 合理价值21元
2011-06-27,中航发动机成航空动力间接控股股东
2010-11-18,航空动力组建合资公司
2010-09-01,航空动力：目标价位33-36元 强烈推荐
2010-08-24,快讯：资产注入掀风暴 航空动力两涨停
2010-08-23,航空动力：拟41亿购“发动机”
2010-08-22,航空动力：将成为ST宇航间接股东
2010-07-22,航空动力：严打内幕交易 早盘急升遭停牌
2010-07-21,航空动力筹划重组事宜 明起停牌
2010-01-07,神秘大鳄现身航空动力 疑为亚派投资掌门
