Time,Content
2021-11-29,浦东建设：为提升闲置资金使用效率 向浦发银行等购买委托理财产品
2021-11-24,科远智慧回复关注函：尚未收到浦发银行南通分行提供的任何质押手续证明材料
2021-11-22,浦发银行(600000.SH)：发行金融债券获银保监会核准
2021-11-19,浦发银行给予上海国际集团150.4亿元人民币综合授信额度
2021-11-19,浦发银行(600000.SH)：同意给予上海国际集团综合授信额度150.4亿元
2021-11-16,科远智慧近3亿存款“毫不知情”被质押？浦发银行回应！
2021-10-31,浦发银行(600000.SH)第三季度净利润116.98亿元 同比下降25.90%
2021-10-29,浦发银行：前三季度营收1434.8亿元，连续7季度实现不良“双降”
2021-10-29,浦发银行：前三季度营业收入1434.8亿元 归属于母公司股东的净利润415.36亿元
2021-10-27,浦发银行信用卡中心上半年平均每千万个人客户投诉量位居在沪持牌信用卡中心首位
2021-09-15,航新科技(300424.SZ)：拟向浦发银行广州分行申请授信额度1亿元
2021-08-28,浦发银行(600000.SH)：上半年归母净利增3.05%至298.38亿元
2021-08-13,浦发银行(600000.SH)：同意给予东方证券综合授信额度195亿元
2021-07-25,智度股份：控股子公司与浦发银行等签署合作协议 共建供应链金融服务体系
2021-07-16,斥资400多万锁定两年 浦发银行开启新一轮高管增持
2021-07-15,浦发银行(600000.SH)：5名高管合计买入43.55万股
2021-07-13,浦发银行(600000.SH)2020年度普通股分红派息10派4.8元 股权登记日为7月20日
2021-06-24,浦发银行：公司持续推进网点建设和布局
2021-06-03,浦发银行(600000.SH)：董桂林董事任职资格获中国银保监会核准
2021-05-26,天泽信息(300209.SZ)：收到浦发银行的催收函等 要求7日内归还贷款本金1.89亿元及相关利息
2021-04-22,浦发银行困局：上市22年首次利润下滑 理财业务投诉量位居股份行首位
2021-04-21,浦发银行私行部老总遭举报！复旦硕士或涉嫌论文抄袭？查重率高达53.4%
2021-03-31,浦发银行与中国信息通信研究院成立数字金融联合创新中心
2021-03-31,以“智”提质 浦发银行提升数字化远程客户服务体验
2021-03-31,浦发银行：公司营业收入主要由利息净收入、手续费及佣金净收入、和其他净收入构成
2021-03-29,浦发银行公布2020业绩，净利润现上市22年来首次负增长
2021-03-27,浦发银行2020年净利583亿下滑0.99%：董事长郑杨薪酬80万
2021-03-27,浦发银行2020年盈利指标下滑，股价长期破净，股东大举套现金额超46亿元
2021-03-26,浦发银行(600000.SH)完成发行2021年第一期金融债券
2021-03-26,浦发银行(600000.SH)2020年度净利润降0.99%至583.25亿元 拟10派4.8元
2021-03-26,建设机械(600984.SH)拟向浦发银行西安分行申请办理2亿元授信额度
2021-03-19,浦发银行分/支行乱象：贷款被挪用，违规通过贷款、理财提供融资
2021-03-17,天赐材料(002709.SZ)：子公司九江天赐拟向浦发银行九江分行申请不超2亿元项目贷款
2021-03-15,浦发银行：获准发行不超600亿元金融债券
2021-03-12,浦发银行(600000.SH)获准发行不超600亿元金融债券
2021-03-02,浦发银行携手汇添富开启银基生态合作新模式
2021-02-02,开除党籍!浦发银行原副行长穆矢严重违纪违法
2021-02-02,太大胆！夫妻共贪，为防被查伪造证据，浦发银行原副行长离职3年后被开除党籍
2021-01-27,浦发银行2020年度净利583.25亿下滑0.99% 资产质量持续向好
2021-01-04,宝明科技(002992.SZ)：拟新增向浦发银行深圳分行龙华支行申请综合授信额度2.8亿元
2020-12-29,阳普医疗(300030.SZ)：浦发银行批复予公司1.5亿元授信额度
2020-12-29,浦发银行(600000.SH)：董事会同意给予国泰君安证券综合授信额度246亿元
2020-12-29,[中科金财]中科金财与浦发银行北京分行“基于API的场景适配中台产品”入选北京金融科技创新监管试点
2020-12-22,浦发银行(600000.SH)：吴弘独董任职资格获银保监会核准
2020-12-14,浦发银行董事刘培峰因工作调动原因辞职
2020-12-11,溢多利(300381.SZ)拟向浦发银行珠海分行申请不超1.45亿元综合授信额度
2020-12-10,北元集团(601568.SH)：董事会同意公司与浦发银行榆林分行建立战略合作关系
2020-11-24,"[正邦科技]浦发银行南昌分行党委书记、行长黄旭东一行抵正邦座谈,助力正邦冲刺千亿目标,挺进世界500强"
2020-11-20,[中科曙光]签了!中科曙光与浦发银行开启战略合作
2020-11-12,浦发银行(600000.SH)：同意给予上海国际集团综合授信人民币80.4亿元、港币5亿元
2020-11-04,[新凤鸣]浦发银行杭州分行副行长金晓峰一行莅临指导
2020-11-01,浦发银行2020年前三季度净利447.42亿 同比下滑7.46%
2020-10-31,浦发银行：2020年前三季度主要财务指标
2020-10-22,浦发银行：“浦发转债”2020年付息事宜的公告
2020-10-15,浦发银行：第七届董事会第十四次会议决议公告
2020-10-10,[上海建工]集团与浦发银行签署战略合作备忘录
2020-09-15,新雷能(300593.SZ)：拟向浦发银行申请5000万元综合授信
2020-09-15,浦发银行职工监事张宜临因已届退休年龄辞任
2020-09-04,[云南能投]浦发银行昆明分行到集团交流座谈
2020-08-31,浦发银行2020年上半年净利289.55亿减少9.8% 集团实现利息净收入下降
2020-08-30,9月解禁股数降逾五成 下周浦发银行、牧原股份解禁市值超百亿
2020-08-28,浦发银行：上半年营收1014.07亿元 非利息净收入占比升至38.98%
2020-08-28,浦发银行半年报：上半年实现净利润289.55亿元 同比下降9.81%
2020-08-14,浦发银行获批筹建理财子公司 净值型理财产品规模已达9000亿
2020-08-14,浦发银行获批筹建理财子公司 净值型理财产品规模已达9000亿
2020-08-14,浦发银行获批筹建理财子公司 净值型理财产品规模已达9000亿
2020-08-13,规模近1.5万亿！又一家银行理财子公司获批筹建 注册地在上海
2020-08-12,浦发银行与华为签署全面战略合作协议
2020-08-11,浦发银行“12宗罪”，被罚2100万！
2020-08-11,浦发银行7年12宗违法违规 收上海银保监局2100万罚单
2020-08-11,浦发银行镇江分行违法遭罚 未及时申报国际收支统计
2020-08-06,浦发银行奉贤支行违法遭罚 部分员工违规经商办企业
2020-08-06,浦发银行南市支行违法遭罚50万 投后管理严重不审慎
2020-07-31,浦发银行石家庄分行架起金融服务“连心桥” 与企业“疫”路同行
2020-07-27,[佛燃能源]佛燃能源与浦发银行佛山分行举行党建合作共建签约授牌仪式
2020-07-15,浦发银行本溪分行2宗违法遭罚 贷款支付管理不合规
2020-07-14,浦发银行天津一支行三宗违法遭罚 未按规定报送资料
2020-07-08,浦发银行大连分行4宗违规遭罚190万 贷款未按约定用途
2020-07-07,浦发银行重庆分行小微信贷中心总经理遭警告 管理存责
2020-06-30,浦发银行：银保监会同意公司发行不超过800亿元的二级资本债券
2020-06-29,浦发银行监事会主席孙建平辞职 由于已届退休年龄
2020-06-29,浦发银行监事会主席孙建平因已届退休年龄辞任
2020-06-22,*ST沈机一字跌停 进出口银行交通银行浦发银行等持股
2020-06-19,浦发银行：2019年年度股东大会决议公告
2020-06-18,浦发银行：第七届董事会第十次会议决议公告
2020-06-10,浦发银行重庆分行4宗违法遭罚200万 贷前调查不尽职
2020-06-09,浦发银行重庆分行原副行长遭处罚 对违规负领导责任
2020-06-08,[海宁皮城]皮城担保与浦发银行签署2亿元战略合作协议
2020-06-08,[海宁皮城]皮城担保与浦发银行签署2亿元战略合作协议
2020-05-22,浦发银行石家庄分行首笔新基建项目贷款高效落地
2020-05-13,浦发银行副行长徐海燕辞职 2019年薪酬为103.07万元
2020-05-11,浦发银行不良率再超2%：拨备覆盖率压线达标 资产质量承压
2020-04-25,浦发银行2020年第一季度盈利173.61亿 同比增长5.48%
2020-04-25,浦发银行2019年净利589.11亿增长5.36% 各板块业务取得新进展
2020-04-25,浦发银行：2019年年度主要财务指标
2020-04-25,浦发银行：2020年第一季度主要财务指标
2020-04-25,浦发银行：第七届董事会第八次会议决议公告
2020-04-24,浦发银行：2019年净利润同比增长5.36% 拟10派6元
2020-04-15,[国泰君安]携手服务国家战略 国泰君安与浦发银行达成战略合作
2020-04-13,中通国脉：拟向浦发银行长春分行申请1亿元综合授信额度 提高资金营运能力
2020-04-12,浦发银行石家庄分行一季度代理承销额翻番
2020-03-30,浦发银行石家庄分行“离岸直贷”支持企业跨境融资
2020-03-25,[桐昆股份]浦发银行杭州分行副行长高建兵莅临桐昆调研
2020-03-20,浦发银行：第七届董事会第六次会议决议公告
2020-03-09,[正平股份]浦发银行西宁分行李毅东副行长一行参观考察正平股份
2020-02-28,浦发银行：优先股二期股息发放实施公告
2020-02-28,浦发银行：第七届董事会第五次会议决议公告
2020-02-21,贝壳找房牵手浦发银行，足不出户交易房产
2020-02-03,浦发银行：第七届董事会第四次会议决议公告
2020-02-03,浦发银行：捐赠2000万元支持新冠肺炎疫情防控工作
2020-01-22,浦发银行：第七届董事会第三次会议决议公告
2020-01-21,浦发银行业绩快报：2019年净利润增长5.36%
2020-01-21,浦发银行资产规模站上七万亿新台阶
2020-01-21,浦发银行业绩快报：2019年净利同比增5.36%
2020-01-21,浦发银行：2019年净利589亿元 同比增长5%
2020-01-21,浦发银行：2019年度净利润589.11亿元 增长5.36%
2020-01-14,姚记科技向浦发银行申请贷款3.3亿 控股股东姚朔斌将3400万股股票作质押
2020-01-01,浦发银行：第七届董事会第二次会议决议公告
2019-12-29,浦发银行：董事长及副董事长、行长任职资格获银保监会核准
2019-12-29,浦发银行：董事长及副董事长、行长任职资格获银保监会核准
2019-12-19,[正平股份]浦发银行西宁分行李毅东副行长一行参观考察正平股份
2019-12-19,[正平股份]浦发银行西宁分行李毅东副行长一行参观考察正平股份
2019-12-17,浦发银行：第七届董事会第一次会议决议公告
2019-12-17,浦发银行：2019年第一次临时股东大会决议公告
2019-12-06,午间公告：长青集团拟向浦发银行申请4亿元授信额度
2019-12-06,午间公告：长青集团拟向浦发银行申请4亿元授信额度
2019-11-29,浦发银行：关于召开2019年第一次临时股东大会的通知
2019-11-29,浦发银行：第六届董事会第五十二次会议决议公告
2019-11-28,中金公司与浦发银行签署全面战略合作协议
2019-11-21,浦发银行可转债发行收官不足1月 大股东减持5000万张
2019-11-21,浦发银行：优先股一期股息发放实施公告
2019-11-21,浦发银行：第六届董事会第五十一次会议决议公告
2019-11-20,浦发银行：第一大股东及其一致行动人减持可转债
2019-11-20,浦发银行：第一大股东及一致行动人减持公司可转债5000万张
2019-11-08,浦发银行独立董事乔文骏辞职
2019-11-07,浦发银行副董事长、行长刘信义辞职
2019-11-01,浦发银行或现高管变动 面临转型与合规双重高压
2019-10-31,浦发银行前三季度盈利483.5亿 同比增长11.9%
2019-10-31,[中利集团]浦发银行沈阳分行党建工作专题调研会议在中德商学院顺利举行
2019-10-30,浦发银行：2019年前三季度主要财务指标
2019-10-30,浦发银行：第六届董事会第五十次会议决议公告
2019-10-29,浦发银行：前三季度净利483.5亿元 同比增长11.9%
2019-10-29,浦发银行前三季净利同比增长11.9%
2019-10-29,浦发银行：前三季净利同比增长11.9%
2019-10-29,浦发银行可转债中签号出炉 共343.69万个
2019-10-29,浦发银行：浦发转债网上中签结果 中签号码共343.7万个
2019-10-28,500亿浦发转债网上申购 系A股史上最大规模可转债
2019-10-24,航天信息：签约浦发银行发票管理系统电子发票功能建设项目
2019-10-24,[数说]北向资金今日净流入5.6亿 净买入中国平安超2亿浦发银行等银行股遭抛售
2019-10-24,浦发银行将融资500亿元 A股史上最大规模可转债启动发行
2019-10-24,浦发银行：公开发行可转换公司债券发行公告
2019-10-24,[航天信息]航天信息签约浦发银行发票管理系统电子发票功能建设项目
2019-10-24,[航天信息]航天信息签约浦发银行发票管理系统电子发票功能建设项目
2019-10-24,[航天信息]航天信息签约浦发银行发票管理系统电子发票功能建设项目
2019-10-15,[金科文化]会说话的汤姆猫×浦发银行:汤姆猫首张联名信用卡昨日发布
2019-09-21,浦发银行：第六届董事会第四十九次会议决议公告
2019-08-23,浦发银行：2019年半年度主要财务指标
2019-08-23,浦发银行：第六届董事会第四十八次会议决议公告
2019-08-23,浦发银行行长刘信义回应美国司法机构调查：美国司法部门未发现三家银行有不当行为
2019-08-23,浦发银行上半年净利321亿元 同比增长12.38%
2019-08-23,浦发银行2019年上半年盈利382.2亿 投资企业经营良好
2019-08-23,浦发银行：上半年净利321亿元 同比增长12.38%
2019-08-23,浦发银行：上半年净利321亿元 同比增长12%
2019-08-03,[新凤鸣]浦发银行一行领导莅临指导
2019-07-23,浦发银行：第六届董事会第四十七次会议决议公告
2019-07-20,浦发银行刘信义：银行理财子公司要脱离母行独立运作
2019-07-12,浦发银行：300亿元永续债发行完毕
2019-07-09,浦发银行即将换帅 上海地方金融监管局局长郑杨接任董事长
2019-07-05,浦发银行零售存款突破8000亿元
2019-07-04,浦发银行挂牌出售总部东银大厦项目 底价20.68亿元
2019-07-02,浦发银行获央行批准发行不超300亿元永续债
2019-07-02,浦发银行：获央行批准发行不超300亿元永续债
2019-06-28,浦发银行杭州分行副行长高建兵：银行应创新金融服务助力科创型企业发展
2019-06-27,浦发银行：第六届董事会第四十六次会议决议公告
2019-06-25,浦发银行回应：未因涉嫌违反任何制裁法律而受到相关调查
2019-06-20,浦发银行：获准发行300亿元无固定期限资本债券
2019-06-14,浦发银行：第六届董事会第四十五次会议决议公告
2019-06-12,恒大集团与浦发银行达成战略合作 获600亿授信
2019-06-10,浦发银行获行长及副行长等7名高管买入40.8万股
2019-06-10,浦发银行：获行长及副行长等7名高管买入40.8万股
2019-06-10,浦发银行：行长等多名高管6月10日合计买入公司40.8万股股票
2019-06-10,浦发银行：今日获行长及副行长等7名高管买入40.8万股
2019-06-04,浦发银行：2018年年度权益分派实施公告
2019-06-03,浦发银行：年报推10派3.5元 股权登记日6月10日
2019-05-14,经营数据整体向好背后：浦发银行不良仍待出清
2019-05-04,浦发银行一季度净利164.6亿元同比增长15% 现金流量净额为1854.3亿元
2019-04-29,浦发银行一季度营收大增27%，存款增量位居股份行首位
2019-04-29,浦发银行：一季度净利165亿元 同比增15%
2019-04-25,浦发银行：2018年年度股东大会决议公告
2019-04-18,[新凤鸣]浦发银行嘉兴分行行长徐军一行莅临指导
2019-04-04,浦发银行贷款损失计提583亿涨10% 增幅明显
2019-04-02,浦发银行：已成立理财子公司筹备工作组
2019-03-26,浦发银行：关于召开2018年年度股东大会的通知
2019-03-26,浦发银行：2018年年度主要财务指标
2019-03-26,浦发银行：第六届董事会第四十三次会议决议公告
2019-03-26,实现营收1715.42亿 浦发银行去年净利增长3.05%
2019-03-25,浦发银行：2018年净利润559亿元同比增3% 拟10派3.5元
2019-03-25,浦发银行2018年净利增长3% 拟10派3.5元
2019-03-25,浦发银行：2018年净利559亿元同比增3% 拟10派3.5元
2019-03-25,浦发银行：2018年净利同比增3% 拟10派3.5元
2019-03-18,ST 致生向浦发银行借款900多万逾期未还 被法院判决要求立即归还
2019-03-15,浦发银行：获准发行不超过500亿元金融债券
2019-03-15,浦发银行：获准发行不超500亿元金融债券
2019-03-15,浦发银行获准发行不超过500亿元金融债券
2019-03-07,中船集团与浦发银行战略合作 涉授信业务等领域
2019-02-27,浦发银行：批准资产损失核销合计11.81亿元
2019-02-27,浦发银行：优先股二期股息发放实施公告
2019-02-27,浦发银行：第六届董事会第四十二次会议决议公告
2019-02-27,浦发银行：批准资产损失核销11.81亿元
2019-02-27,浦发银行：批准资产损失核销金额11.81亿元
2019-02-27,浦发银行：派发优先股二期股息8.25亿元
2019-02-12,午间公告集锦：聚龙股份中标浦发银行项目
2019-02-12,午间公告：聚龙股份中标浦发银行项目；永安药业业绩或受负面影响
2019-02-01,浦发银行：第六届董事会第四十一次会议决议公告
2019-01-31,古鳌科技中标浦发银行清分机采购招标项目
2019-01-31,古鳌科技：中标浦发银行清分机采购项目
2019-01-29,[聚龙股份]聚龙股份有限公司关于收到浦发银行中标通知书的公告
2019-01-15,浦发银行：第六届董事会第四十次会议决议公告
2019-01-14,[皇氏集团]浦发银行南宁分行党委书记、行长吴长路一行到皇氏集团开展党建工作交流会
2019-01-07,平安、浦发业绩预喜 北向资金闻风而“入”银行股
2019-01-03,上市公司数据速递：浦发银行2018年净利同比增3.05％
2019-01-03,浦发银行：2018年净利559亿元 同比增3%
2018-12-29,浦发银行：第六届董事会第三十八次会议决议公告
2018-12-08,浦发银行：第六届董事会第三十七次会议决议公告
2018-11-22,浦发银行：优先股一期股息发放实施公告
2018-11-19,浦发银行：第六届董事会第三十六次会议决议公告
2018-11-14,券商家道中落：全行业前三季度利润跟浦发银行相当
2018-11-13,西部证券将联合浦发银行长安信托设百亿民企扶助基金
2018-11-04,[*ST南风]南风化工战略合作浦发银行
2018-11-04,[ST南风]南风化工战略合作浦发银行
2018-10-31,浦发银行：2018年前三季度主要财务指标
2018-10-31,浦发银行：第六届董事会第三十五次会议决议公告
2018-10-30,浦发银行连续三个季度缩表，证金公司继续增持
2018-10-24,银行股集体走高 浦发银行大涨4%
2018-10-17,聚龙股份中标浦发银行及浙商银行采购项目
2018-10-17,聚龙股份：中标浙商银行及浦发银行采购项目
2018-09-28,浦发银行：2018年第一次临时股东大会决议公告
2018-09-25,神州信息加入浦发银行科技合作共同体
2018-09-19,浦发银行：200亿二级资本债券发行完毕
2018-09-19,"[天邦股份]公司新闻 | 嘉宾盈门,共谋发展——浙江农发牧业、浦发银行、丰原集团来宾莅临汉世伟考察指导"
2018-09-15,浦发银行拟向大生农业金融子公司索偿4440万元
2018-09-14,航天科技集团与浦发银行签署战略合作协议
2018-09-11,浦发银行：关于召开2018年第一次临时股东大会的通知
2018-09-10,涉嫌洗钱连收罚单 浦发银行过去半年诸事不遂
2018-09-07,浦发银行200亿元二级资本债券发行完毕
2018-09-07,浦发银行：200亿元二级资本债券发行完毕
2018-09-07,中国华融与浦发银行签署全面战略合作协议
2018-08-30,浦发银行：上半年净利285.69亿元 同比增1.43%
2018-08-30,浦发银行：拟不超100亿元设资管子公司
2018-08-29,浦发银行：上半年净利同比增1.43% 拟百亿设资管子公司
2018-08-29,浦发银行上半年净利微增 出资100亿元设立产管理子公司
2018-08-27,[光明地产]浦发银行昆明分行来集团交流昆明项目的融资与合作
2018-08-23,浦发银行：公开发行不超400亿元二级资本债券获批
2018-08-15,[太钢不锈]高祥明会见浦发银行太原分行行长白海忠
2018-07-30,[浦发银行]浦发银行积极推进理财产品净值化转型
2018-07-30,[浦发银行]浦发银行三地应用开发服务分中心正式启用
2018-07-30,[浦发银行]浦发行长刘信义:银行资管需充分利用当前战略机遇期
2018-07-24,浦发银行：发行不超400亿元二级资本债券获银保监会批复
2018-07-19,浦发银行：第六届董事会第三十三次会议决议公告
2018-07-16,浦发银行丽水违法保管客户空白合同 吃银监分局罚单
2018-07-15,浦发银行6高管增持34.85万股 没有散户买得多？
2018-07-13,市净率跌到0.71倍 浦发银行高管们连续两日增持护盘
2018-07-13,[浦发银行]浦发银行推出业内首个API Bank无界开放银行 重构银行业务和服务模式
2018-07-13,[华钰矿业]华钰矿业总经理徐建华参加浦发银行西藏自治区分行座谈
2018-07-12,"浦发银行高管掏腰包买自家股票 ""强心针""或""遮羞布"""
2018-07-12,浦发银行：多名高管买入公司股票
2018-07-12,浦发银行副董事长等高管近日增持34.85万股
2018-07-06,浦发银行：2017年年度权益分派实施公告
2018-07-02,浦发银行大连分行违法遭罚 个人信用信息管理突破红线
2018-06-27,浦发银行：第六届董事会第三十二次会议决议公告
2018-06-15,浦发银行太原违法正常贷款变次级类贷款 转让不良资产
2018-06-14,浦发银行郑州服务收费质价不符 违法违规领银监罚单
2018-06-14,浦发银行郑州信用证议付资金违法回流开证人遭罚
2018-06-13,浦发银行郑州票据贴现资金违法回流出票人 遭监管处罚
2018-06-11,浦发银行郑州贷款违法购买本行理财产品 接银监罚单
2018-06-08,浦发银行郑州分行贷款违法流入房地产 河南银监罚款
2018-06-01,浦发银行加码调结构转型 探索金融科技新路径
2018-05-30,浦发银行与蚂蚁金服战略合作
2018-05-29,[浦发银行]浦发银行与蚂蚁金服达成全面战略合作
2018-05-29,[泛海控股]民生证券与浦发银行北京分行签署战略合作协议
2018-05-28,浦发银行：2017年年度股东大会决议公告
2018-05-28,[浦发银行]“管家式”私行服务再升级
2018-05-28,[浦发银行]浦发私人银行服务再升级 推出“知享·慧生活”私人管家平台
2018-05-23,浦发银行：第六届董事会第三十一次会议决议公告
2018-05-23,浦发银行：董事会同意20亿元入股国家融资担保基金
2018-05-16,[浦发银行]浦发银行创新消保新模式 让金融知识“活”起来
2018-05-11,[苏州银行]苏州银行与浦发银行签署《全面业务合作协议》
2018-05-07,A股银行首季战报：浦发银行增速垫底 江阴不良率卫冕
2018-05-04,浦发银行曝19宗违法违规 银监会罚没5855万元
2018-05-02,涨停复盘:白马股又出三坑八一东阿浦发 指数持续阴跌
2018-05-02,浦发银行赣州分行违反反洗钱法 两高管遭央行罚款
2018-04-28,[浦发银行]浦发银行发布2017年年度报告
2018-04-27,浦发银行2017年度净利润同比增长2.18%
2018-04-27,浦发银行：2017年实现净利逾542亿元 同比增长2.18%
2018-04-25,[浦发银行]浦发银行多措并举 优化企业开户服务
2018-04-25,[浦发银行]浦发银行镇江分行带着“星星的孩子”放飞希望的风筝
2018-04-25,"[浦发银行]浦发银行信用卡中心为""海淘族""提供便捷支付服务"
2018-04-23,浦发银行台州贷款违规转存款 为贷款与汇票质押担保
2018-04-23,[浦发银行]浦发银行多措并举优化企业开户服务助力改善营商环境
2018-04-10,[山推股份]定了!徐工集团与浦发银行总行开启战略合作新时代
