Time,Content
2021-11-30,博采网络做市商队伍扩大至12家 中泰证券、东北证券等“做市大户”加入
2021-11-19,海看股份过会：今年IPO过关第367家 中泰证券过4.5单
2021-11-18,裕兴股份(300305.SZ)：11月17日接待了中泰证券等28家机构投资者调研
2021-11-11,天朔医疗：基于战略规划需要，“分手”中泰证券终止精选层小IPO辅导备案
2021-10-29,中泰证券：前三季度净利润25.44亿元，同比增长10.88%
2021-10-22,中泰证券(600918.SH)：完成发行25亿元短期融资券
2021-10-08,宏力能源未按规定披露年报收警示函 主办券商中泰证券
2021-09-29,复星医药跌8.52% 中泰证券中信证券一个月前喊买入
2021-09-29,北方稀土跌6.37% 中泰证券浙商证券上月末喊买入
2021-09-28,科沃斯跌3.37% 招商证券中泰证券上月末唱多
2021-09-27,北方稀土跌停 中泰证券浙商证券上月末喊买入
2021-09-24,欧圣电气过会：今年IPO过关第322家 中泰证券过3.5单
2021-09-17,中泰证券(600918.SH)：发行次级公司债券获得证监会注册批复
2021-09-17,恒立液压跌4.4% 中金公司中泰证券高点唱多
2021-09-16,满坤科技IPO实控人行贿被问询 保荐机构为中泰证券
2021-09-15,复星医药跌5.79% 中泰证券中信证券20天前喊买入
2021-09-15,维远股份IPO超募20亿 中信证券中泰证券合赚1.6亿
2021-09-14,"拟三板转A,唐山华熠携手中泰证券计划首次公开发行股票并上市"
2021-09-10,中泰证券副总经理刘珂滨辞职 2020年薪酬为512.31万
2021-09-10,中泰证券：刘珂滨辞去副总经理职务
2021-09-07,金域医学跌3.10% 中泰证券浙商证券西部证券高点唱多
2021-09-05,中泰证券：积极组织参与北京证券交易所的各项业务 把握中小企业发展黄金机遇期
2021-09-03,华友钴业跌停 中泰证券上周末喊买入
2021-09-03,韦尔股份跌3.73% 中泰证券周一喊买入
2021-09-02,海天味业跌3.49% 中泰证券平安证券民生证券前天唱多
2021-09-02,韦尔股份跌5.84% 中泰证券周一喊买入
2021-09-02,中泰证券上半年营收净利均增2成 员工薪酬总额增34%
2021-08-31,韦尔股份跌9.39% 中泰证券昨日刚喊买入
2021-08-30,科沃斯跌停 招商证券中泰证券昨日刚喊买入
2021-08-27,中泰证券2021年半年度净利17.01亿元 同比净利增加22.99%
2021-08-27,中泰证券(600918.SH)半年度净利润17.01亿元 同比增长22.99%
2021-08-27,华兰生物跌停 中信证券中泰证券去年高点喊买
2021-08-20,恒立液压跌8.38% 中金公司中泰证券高点唱多
2021-08-18,中泰证券(600918.SH)董事会批准试点开展公募基金投资顾问业务
2021-08-17,万华化学跌3% 安信证券中泰证券高点喊买
2021-08-15,中泰证券收警示函 受托管理福建福晟债券项目未尽责
2021-08-12,骏发生物信披违规实控人收警示函 主办券商为中泰证券
2021-08-11,中泰证券(600918.SH)：济钢集团拟将所持5.05%股份无偿划转至莱钢集团
2021-07-30,中泰证券聘任胡增永为公司副总经理 一季度公司净利下滑11.32%
2021-07-23,中泰证券发行25亿短期融资券 票面利率2.38%
2021-07-23,中泰证券(600918.SH)：完成发行25亿元第二期短期融资券
2021-07-23,【龙虎榜】中泰证券7月23日成交明细
2021-07-23,中泰证券涨停，全市场最大证券ETF(512880)涨超1.5%
2021-07-22,中泰证券发布上半年业绩预增公告：净利同比增长20%至30%
2021-07-22,2021年Q2新三板主办券商执业评价：开源证券稳居第一 中泰证券跌出前五
2021-07-22,中泰证券：上半年净利润预计同比增长20%-30%
2021-07-21,中泰证券2021年上半年预计净利同比增长20%-30% 全面提升综合金融服务能力
2021-07-21,中泰证券(600918.SH)上半年净利预增20%-30%
2021-07-21,中泰证券：洋河股份改善逻辑正加速兑现，应当重视拐点向上趋势的力量
2021-07-16,青达环保上市首日涨135% IPO募2.5亿中泰证券赚0.28亿
2021-07-16,乖宝宠物拟IPO，中泰证券担任辅导机构
2021-07-08,中泰证券(600918.SH)2020年度权益分派10派1.09元 股权登记日为7月15日
2021-07-08,中泰证券(600918.SH)：拟增加中泰创业投资(深圳)注册资本合计不超10亿元
2021-07-05,中泰证券(600918.SH)：试点开展基金投资顾问业务收到证监会无异议复函
2021-07-05,泰德股份拟精选层小IPO，获中泰证券辅导
2021-07-02,泰德股份进精选层辅导期：符合财务标准一 辅导机构为中泰证券
2021-06-24,佳兆业获中泰证券“买入”评级 城市更新龙头地位再获肯定
2021-06-23,中泰证券：中泰证券旗下证券行情/交易APP兼容华为公司鸿蒙系统
2021-06-23,联科科技首日换手0.44% IPO募6.49亿中泰证券赚0.35亿
2021-06-22,中泰证券：银行存款利率上限拟上调，关注两条银行股投资逻辑
2021-06-22,中泰证券：后疫情时代白酒行业景气上行，看好高端酒业绩持续稳健增长
2021-06-21,中泰证券：铁矿价格见顶，持续上涨难以维持
2021-06-16,星辰科技精选层发行价8元/股：6月21日申购 获中泰证券等7家战投加持
2021-06-16,中泰证券：煤炭供应短缺时代开启 行业景气度向上
2021-06-07,中泰证券：“深耕山东”成效显著 发力布局区域金融生态
2021-06-03,A股异动丨中泰证券(600918.SH)大跌6.42% 约19.12亿股首发限售股今日解禁
2021-05-28,中泰证券:19.12亿股首次公开发行限售股将于6月3日上市
2021-05-27,中泰证券(600918.SH)：约19.12亿股首发限售股6月3日解禁
2021-05-27,中泰证券：两个思路，把握“赢家通吃”带来的投资机会
2021-05-25,中泰证券：钠离子电池不改锂中长期高景气
2021-05-24,中泰证券：疫情不改医疗IT成长性，政策持续驱动高景气
2021-05-21,夜光明拟精选层小IPO，中泰证券担任辅导机构
2021-05-17,中泰证券：4月销量符合预期，继续看好新能源车板块行情
2021-05-17,中泰证券：爱美客拟港股上市，考虑公司竞争优势、持续重点看好
2021-05-10,中泰证券：通信运营商盈利逐步改善，关注五个投资方向
2021-05-07,中泰证券：抗疫需求持续释放，医疗新基建带动新增长
2021-05-06,中泰证券：深入推进区域突破战略 持续提升区域市场竞争力
2021-04-30,中泰证券：宁德时代业绩符合预期，四季度高排产带动全年增长
2021-04-29,雄汇医疗信披违规实控人收警示函 主办券商中泰证券
2021-04-29,中泰证券：东方财富2020年报及一季报表现优异，净利润率超预期提升
2021-04-28,新益昌上市首日涨235% IPO募5亿中泰证券赚3250万
2021-04-28,中泰证券(600918.SH)：一季度净利降11.32%至6.66亿元
2021-04-28,中泰证券：爱美客盈利持续提升，业绩超预期，持续重点看好
2021-04-26,中泰证券A股首秀年报股价跌7% 去年人均薪酬福利52万
2021-04-26,中泰证券：市场交易结构拥挤导致“抱团白马股”出现调整 客关注三个领域投资机会
2021-04-25,中泰证券上市首份年报出炉，归母净利润同比增长12.26%
2021-04-24,中泰证券：2021年A股全年盈利增速有望在16％左右
2021-04-24,中泰证券2020年净利增长12.26% 董事长李峰薪酬5.73万
2021-04-23,中泰证券(600918.SH)2020年度净利润升12.26%至25.25亿元 拟10派1.09元
2021-04-23,中泰证券：如何把握“人口转型”下资本市场的投资机会？
2021-04-22,中泰证券解读平安银行一季报：业绩高增，财富管理持续发力
2021-04-22,中泰证券：隆基股份业绩持续超预期，硅片盈利能力强
2021-04-19,中泰证券：报团白马股的“瓦解”，关注基本面扎实、估值位于合理位置的行业和标的
2021-04-15,“牵手”中泰证券，邦德股份进入创业板IPO辅导阶段
2021-04-06,中泰证券：银行资产质量稳中改善 推荐两条选股逻辑
2021-04-06,中泰证券：拜登2万亿基建刺激计划对资本市场影响几何？
2021-04-02,"中泰证券：医药板块筑底回升,核心关注业绩主线"
2021-04-01,中泰证券：不确定性逐步消退 乐观看待4月行情
2021-03-29,中泰证券评华达科技：创收+降本 业绩表现超预期
2021-03-24,中信特钢跌6.56% 上月初中泰证券平安证券唱多
2021-03-24,中泰证券：农产品价格上涨，复合肥景气上行
2021-03-23,北方稀土跌6.39% 月初中泰证券发研报喊买入
2021-03-22,万泰生物跌2.66% 1月份中泰证券海通证券研报唱多
2021-03-22,化工板块快速回落，万华化学跌近5%，中泰证券化工：原油中期存回暖预期，龙头价值穿越周期
2021-03-20,中泰证券：不应对拜登刺激计划期望过高，美债利率上行对我国经济和股市影响相对有限
2021-03-19,恒生电子跌4.5% 安信国盛中泰证券去年高点喊买
2021-03-19,智飞生物跌4% 上月底中金公司西部证券中泰证券喊买
2021-03-19,恒立液压跌近7% 年内高点中金公司中泰证券唱多
2021-03-15,韦尔股份跌5.96% 中银证券中泰证券中国银河高点喊买
2021-03-15,丽人丽妆跌6.17%中信证券持股 中泰证券最高点喊买
2021-03-15,万泰生物跌5.7% 1月份中泰证券海通证券研报唱多
2021-03-15,中泰证券：银行行业景气向上，建议关注两条选股主线
2021-03-12,斯瑞尔终止创业板IPO 中泰证券保荐折戟
2021-03-12,中泰证券：从“抱团”现象，增加权益基金的评价维度
2021-03-11,上市计划调整，扬德环境终止中泰证券创业板IPO辅导
2021-03-10,江山欧派跌5% 去年高点中泰证券长江证券喊买
2021-03-09,中信特钢跌8.7% 上月初中泰证券平安证券唱多
2021-03-09,智飞生物跌11% 上月底中金公司西部证券中泰证券喊买
2021-03-08,万泰生物跌8% 1月份中泰证券海通证券研报唱多
2021-03-08,中泰证券：银行贷款利率上升 有望持续较长时间
2021-03-04,智飞生物跌8.89% 上周中金公司西部证券中泰证券喊买
2021-03-02,中泰证券(600918.SH)：首席信息官程龙辞职
2021-03-02,九号公司跌5.2% 上月初中泰证券太平洋证券喊买入
2021-02-27,A股大跌是美债惹的祸？中泰证券：不会改变A股整体向好的大势，长期抱团风格难逆转
2021-02-26,大调整！中泰证券分公司总经理异地轮岗、这两个部门合并，新董事长在下什么棋？
2021-02-25,中泰证券投行组织架构大变动：19个一级部门合并缩减至8个！
2021-02-24,智飞生物跌7.1% 近3日中金公司西部证券中泰证券喊买
2021-02-24,中泰证券：大宗商品涨价结束了么？
2021-02-23,中信特钢跌8.67% 中泰证券平安证券月初唱多
2021-02-22,贵州茅台跌近7% 中信证券中泰证券申银万国喊买后连跌
2021-02-22,中泰证券：酿酒行业能出院士吗？相关领域已经诞生了院士
2021-02-22,中泰证券：酿酒行业能出院士吗？
2021-02-21,中泰证券辅导，橡胶履带商江西金利隆拟上市
2021-02-19,九号公司跌8.47% 月初中泰证券与太平洋证券喊买
2021-02-19,中泰证券(600918.SH)：向中泰国际增资收到证监会复函
2021-02-18,芒果超媒跌9.3% 西部证券中泰证券万联证券等高点唱多
2021-02-18,万泰生物跌近9% 上月中泰证券海通证券研报唱多
2021-02-10,润普食品进入精选层辅导期：符合财务标准一 辅导机构为中泰证券
2021-02-09,“牵手”中泰证券，麒麟信安拟冲A股IPO
2021-02-08,中泰证券(600918.SH)当年累计新增借款超上年末净资产20%
2021-02-08,克莱特变更主办券商：由中泰证券变更为西南证券
2021-02-05,中泰证券辅导，山东互联网传媒拟冲A
2021-02-05,新瀚新材实控人涉嫌行贿 中泰证券两名保代收监管函
2021-02-05,苏州天禄过会：今年IPO过关第67家 中泰证券过2单
2021-02-03,中泰证券昨日发布2020年业绩快报，今日股价下跌4.70%
2021-02-03,中泰证券去年营收增个位数净利增21% 股价今跌4.7%
2021-02-03,中泰证券：2020年实现归属于股东净利润27.21亿元
2021-02-02,中泰证券2020年度净利27.21亿增长20.95% 公司各项业务稳定
2021-02-01,中泰证券2宗违法遭罚95万 未按规定识别客户身份
2021-01-29,富满电子跌近16%：富国基金等持股 4天前中泰证券喊买
2021-01-28,中伟股份跌9.55% 中泰证券于本月股价最高点喊增持
2021-01-27,德源药业精选层发行价18.3元/股：中泰证券等8家战投承诺认购6700万元
2021-01-27,中泰证券李迅雷：港股热背后的冷思考，无论是楼市还是股市，今后都会面临资产过剩的困扰
2021-01-26,康龙化成今股价跌8% 中泰证券浙商证券昨日刚喊买入
2021-01-25,兴图新科募资5亿上市一年后破发 中泰证券赚3710万
2021-01-25,中孚信息跌14.27% 上周中泰证券发研报喊买入
2021-01-22,中泰证券燃料电池2021投资策略：产业化提速 关注电堆系统及关键零部件国产化机会
2021-01-19,中泰证券集成电路行业报告：八英寸晶圆需求提升 价格具备向上弹性
2021-01-19,中泰证券：服务业、投资、消费均转弱，未来经济走向如何？.
2021-01-15,联科科技过会：今年IPO过关第26家 中泰证券过首单
2021-01-14,中泰证券:为什么地产投资一再被低估？
2021-01-13,中泰证券(600918.SH)：拟变更会计师事务所
2021-01-11,中伟股份跌12% 中泰证券3天前刚发研报唱多
2021-01-11,中泰证券中美游戏公司对比：估值的锚
2021-01-11,中泰证券化妆品2021投资梳理：国货分化 细分崛起
2021-01-08,"中泰证券被史丹利带""跑偏"" 遭""点名""研报客观独立性受质疑"
2021-01-07,中泰证券零售行业2021年度投资策略：需求分化 变革加速
2021-01-06,中泰证券2021年钢铁行业投资策略：提质增效
2021-01-05,中泰证券遭责令改正 分析师写史丹利研报现重大错误
2021-01-05,中泰证券退市新规点评：标准更多元 程序更简化
2021-01-05,中泰证券纺织服装2021年度投资策略：危机中求变 复苏下存机
2021-01-04,中泰证券泰安及下属营业部7项违规 遭证监局责令改正
2021-01-04,中泰证券：元旦票房破纪录 农产品价格续升
2021-01-04,中泰证券《中欧投资协定》签署点评：静待双边投资空间打开 助益市场风险偏好提升
2021-01-04,中泰证券2021年宏观利率展望：潜龙勿用 以逸待劳
2021-01-04,中泰证券2021年资产配置策略报告：繁荣与分化
2021-01-03,中泰证券：行情或步入进攻阶段 仍建议均衡配置（附一月金股）
2020-12-31,中泰证券通信行业2021年投资策略：云网融合加深 掘金5G应用与终端创新
2020-12-29,中泰证券家电2021年度策略：为什么看好白电
2020-12-28,中泰证券农药行业报告：供需矛盾渐缓 龙头企业有望迎来新发展
2020-12-28,中泰证券2021年新能源汽车板块投资策略：成长、周期和重塑 迎接全球电动汽车大爆发
2020-12-28,中泰证券：三次分配下“中产边缘”消费率提升的投资机会
2020-12-25,中泰证券(600918.SH)：有关史丹利的相关研报内容出现重大错误等 收到责令改正的行政监管措施决定书
2020-12-25,中泰证券：收到山东证监局行政监管措施决定书
2020-12-24,新瀚新材过会：今年IPO过关第372家 中泰证券过4单
2020-12-24,中泰证券：利尔化学深度报告 新工艺打造龙头地位 新项目打开成长空间
2020-12-24,中泰证券教育行业2021年度投资策略：后疫情时代的模式优化与效率提升
2020-12-23,中泰证券家电行业11月数据点评：价格回暖持续
2020-12-23,中泰证券：信用债偿债压力几何？
2020-12-23,中泰证券：通用减速机龙头 产能扩张享规模化红利
2020-12-22,中泰证券化工行业2021年度投资策略报告： 疫情后时代，掘金“双循环”
2020-12-22,中泰证券笃慧：内循环背景下 国产高端金属材料全面受益-高温合金等特钢、钛合金篇
2020-12-21,中泰证券：聚焦后疫情时代的“复苏”、“转型”与“升级”——轻工行业2021年投资策略
2020-12-17,券商股强势拉升 哈投股份涨停 中金公司、中泰证券、国联证券等多股大涨
2020-12-17,新益昌：今年科创板过会第204家 中泰证券过4.5单
2020-12-15,斯达半导跌停 月内中泰证券与西部证券研报喊增持
2020-12-11,中泰证券(600918.SH)：拟发行境内外债务融资工具
2020-12-11,中泰证券(600918.SH)：拟向全资子公司中泰创投增资不超15亿元
2020-12-10,中泰证券2021年医药生物投资策略：创新创造价值 寻找医药中的马拉松选手
2020-12-09,联创光电跌停 上月中泰证券与万联证券曾发研报唱多
2020-12-09,青达环保：今年科创板过会第195家 中泰证券过3.5单
2020-12-07,沃森生物跌停:中泰证券资管持股 中银证券刚研报唱多
2020-12-07,中泰证券2021年宏观经济和资产展望：“水”落“石”出
2020-12-04,易华录交易对手国富商通未业绩补偿遭批评 为中泰证券项目
2020-12-01,A股异动 | *ST瀚叶(600226.SH)涨停 中泰证券(上海)资管竞得公司5.67%股权
2020-11-27,中泰证券短期融资券发行 总额为25亿元
2020-11-25,"联创光电跌停 中泰证券今日刚给""买入""评级就收长阴"
2020-11-25,三友医疗跌11% 在中泰证券招商证券唱多声中下跌
2020-11-25,普联软件过会：今年IPO过关第320家 中泰证券过2单
2020-11-24,地瑞科森诉讼信披违规收警示函 主办券商为中泰证券
2020-11-24,富信科技：今年科创板过会第183家 中泰证券过2.5单
2020-11-11,天朔医疗正接受中泰证券精选层辅导 上半年利润1505万元
2020-11-11,中泰证券解除劳动合同被判违法 赔偿前员工29.6万元
2020-11-09,云媒股份虚假信披等4宗违法遭罚 主办券商为中泰证券
2020-11-09,中泰证券宏观：通胀VS通缩 中美宽松模式有何不同？
2020-11-05,中泰证券前三季度净利23亿元 支付给职工现金21亿元
2020-11-03,山东信和案件信披违规收警示函 主办券商为中泰证券
2020-11-02,华兰生物跌停 中泰证券昨日研报刚给“买入”评级
2020-11-01,中泰证券：市场调整可能尚有惯性 但已无需过度悲观(附11月金股)
2020-11-01,中泰证券：资产大跌的背后 经济“爬坑”被暂停
2020-10-31,中泰证券前三季度净利22.95亿增长29.15% 营业外支出下滑
2020-10-30,中泰证券：2020年前三季度主要财务指标
2020-10-27,中泰证券策略：“十四五”规划主线下 硬科技或将再次启航
2020-10-26,丽人丽妆跌停 中泰证券刚发布研报喊买入话音未落
2020-10-26,中泰证券：“十四五”规划主线下 硬科技或将再次启航
2020-10-26,中泰证券：钱都去哪儿了？——基建低增之谜
2020-10-23,"中来股份跌12% 申银万国中泰证券唱多立马遭""打脸"""
2020-10-23,泰和科技今跌11% 中泰证券海通证券中信证券唱多了
2020-10-22,康华生物跌10.5% 近1个月华西证券与中泰证券喊买入
2020-10-15,意华股份跌停 中泰证券一个多月前曾发研报喊买入
2020-10-14,云天软件信披违规收监管函 主办券商为中泰证券
2020-10-12,中泰证券宏观：“久期”的溢价——茅台为啥贵 周期为啥便宜？
2020-10-09,中泰证券：下跌或已接近尾声 关注超跌反弹机会
2020-10-08,中泰证券：情绪性调整接近尾声 红十月可期(附十月金股)
2020-09-17,中泰证券短期融资券发行 总额为25亿元
2020-09-17,又一政府官员掌舵券商！中泰证券高层调整 省财政厅副厅长履新党委书记 将接任董事长
2020-09-16,春泉园林提交精选层辅导材料 此前主办券商由中泰证券变为国融证券
2020-09-16,万业企业买凯世通信披违规收警示函 财务顾问中泰证券
2020-09-16,中泰证券高层调整进行时 李峰正式履任党委书记并即将出任董事长
2020-09-15,雅克科技：拟定增12亿元 开展半导体材料的国产化替代
2020-09-14,长春高新跌停 中金公司中泰证券西部证券高位唱多很
2020-09-11,中泰证券：A股与美股，究竟谁更贵？
2020-09-11,中泰证券：好赛道上跑的究竟有多少匹好马？
2020-09-08,中泰证券：需求趋弱下的供给侧机会
2020-09-05,中泰证券：持续看好线上娱乐消费及线下场景复苏的投资机会
2020-09-01,欧菲光一字跌停 中泰证券两天前刚发研报喊增持了
2020-08-31,中泰证券上半年净利增16%保荐零过会 证券投资收入降
2020-08-31,中泰证券李迅雷：资本市场正进入黄金发展期 同时也是分化的时代
2020-08-31,中泰证券梁中华团队：美元或已见底 人民币汇率仍有压力
2020-08-27,中泰证券2020年上半年净利13.83亿增长16.37% 投资收益同比增加
2020-08-25,志晟信息正接受中泰证券精选层辅导 去年研发费用3318万元
2020-08-24,中泰证券：纸币泛滥大时代，寻找类黄金资产
2020-08-24,兰剑智能过会：今年科创板过会第98家 中泰证券过首单
2020-08-23,中泰证券宏观：纸币泛滥大时代 寻找类黄金资产
2020-08-20,山东路桥11亿收购路桥集团无条件过会 中泰证券护航
2020-08-18,中泰证券：余粮不足？从不同维度观察国内主粮自给情况
2020-08-17,中泰证券宏观：周期的“错觉”
2020-08-16,中泰证券首席经济学家李迅雷：黄金市场就像一座“活火山”
2020-08-13,冬虫夏草子公司食品北京抽检不合格 主办券商中泰证券
2020-08-12,正海磁材终止定增跌近6% 中泰证券说好的228亿市值呢
2020-08-10,中泰证券李迅雷：全球化可逆吗？
2020-08-07,拱东医疗过会：今年IPO获批第140家 中泰证券过首单
2020-08-07,中泰证券点评央行二季度货币政策执行报告：结构宽松为主 降息“门槛”提高
2020-07-30,三炬生物违规实控人骆毛喜遭警示 主办券商为中泰证券
2020-07-28,中泰证券：已完成新三板精选层项目1家 在审3家
2020-07-28,[互动]中泰证券：已完成新三板精选层项目1家 在审3家
2020-07-27,中泰证券宏观：没有必然的上行周期
2020-07-21,中泰证券短期融资券发行 总额为30亿元
2020-07-16,券商板块尾盘杀跌 中泰证券跌停
2020-07-15,【龙虎榜】中泰证券7月15日成交明细
2020-07-13,中泰证券：7月预期国内中游锂电需求恢复 龙头订单预计环比大幅增长
2020-07-12,中泰证券宏观：从全球疫情错位的视角看中国出口为何有韧性？
2020-07-09,【龙虎榜】中泰证券7月9日成交明细
2020-07-08,中泰证券母公司6月份净利2.16亿元环比大增
2020-07-08,【龙虎榜】中泰证券7月8日成交明细
2020-07-08,中泰证券：6月母公司净利润为2.165亿元
2020-07-06,【龙虎榜】中泰证券7月6日成交明细
2020-07-06,券商板块大幅高开 中泰证券、光大证券、浙商证券、中银证券涨停
2020-07-03,【龙虎榜】中泰证券7月3日成交明细
2020-07-02,【龙虎榜】中泰证券7月2日成交明细
2020-06-30,机构押注容大感光 赵老哥割肉中泰证券
2020-06-29,券商股尾盘继续下挫 中泰证券接近跌停
2020-06-29,[华虹计通]党建引领聚合力 结对共建促发展——华虹计通与中泰证券、信投建设举行党建签约仪式
2020-06-28,茅台会更贵，猪肉会更贱？中泰证券：放水是否带来通胀要看资金流向与结构
2020-06-27,中泰证券宏观：放水是否会通胀？茅台还会更贵猪肉还会更便宜
2020-06-22,中泰证券宏观：从日本经验看货币超发未必能推升高通胀
2020-06-19,浙矿股份开板首日上演“天地板” 中泰证券上海四家营业部齐出货
2020-06-16,联迪信息创业板转战精选层：启动相关工作 辅导券商变更为中泰证券
2020-06-15,中泰证券梁中华点评5月经济数据：经济复苏仍偏弱 再下行压力仍大
2020-06-08,中泰证券论债市的非理性调整：“浑水摸鱼”而收水 “鱼”怎么办？
2020-06-05,[券业场] “做最好最专业的骗子”中泰证券百度百科现神口号 网友：真相了！
2020-06-05,[山东钢铁]中泰证券上市成山钢第四家上市企业
2020-06-04,中泰证券：布局“南海琼珠”开放机遇中的五大投资机会
2020-06-04,中泰证券成A股第38家上市券商
2020-06-03,[券业场]九九八十一难！山东“独苗”中泰证券长跑4年终上市 5月刚刚祭出大动作
2020-06-03,中泰证券登陆A股 上市首日无悬念暴涨44%
2020-06-03,中泰证券今日挂牌上市
2020-05-26,全国人大代表、中泰证券董事长李玮：提升违法犯罪成本 为注册制改革保驾护航
2020-05-25,曲线进击的湘财证券将登陆A股 营收却不到中泰证券15%
2020-05-25,中泰证券宏观：债券的牛市或还很长
