Time,Content
2021-03-01,科创板IPO“折戟”后改道创业板，中科晶上重获中信建投证券辅导
2021-03-01,新三板摘牌企业小鸟科技拟闯科创板，已接受中信建投证券辅导
2021-02-25,中信建投(601066.SH)：2020年度第十六期短期融资券兑付完成
2021-02-25,中信建投(601066.SH)：完成发行45亿元短期融资券
2021-02-25,蓝科环保终止科创板IPO 保荐机构为中信建投
2021-02-24,春节后首周公募调仓“冰火两重天”：兴证全球董承非大举加仓近四成，中信建投栾江伟猛踩刹车
2021-02-22,中信建投(601066.SH)：中证监对公司公开发行永续次级债事项无异议
2021-02-22,中信建投证券：机构抱团股票显著下跌，中小盘估值水平显著提升
2021-02-20,中信建投研报：万丰飞机引入国有资本 加速开拓国内通航市场
2021-02-20,中信建投研报：万丰飞机引入国有资本 加速开拓国内通航市场
2021-02-19,中航比特拟冲A，中信建投护航上市路
2021-02-19,中信建投证券：继续看好年报及疫情主线
2021-02-19,中信建投证券：景气再次验证 军工板块有望重回升势
2021-02-18,佰利天拟闯关创业板，已与中信建投签署上市辅导协议
2021-02-18,中信建投证券：京东物流登陆港股在即，春节期间集运运价保持平稳
2021-02-10,银行ETF(512800)1小时净申购超1亿元!中信建投：2021年银行有望修复至1倍PB
2021-02-09,湘潭电化(002125.SZ)：参股公司湖南裕能上市辅导备案 辅导机构为中信建投证券
2021-02-09,中信建投辅导，金凯生科拟登陆A股
2021-02-09,中信建投证券：积极关注新冠疫苗进展 持续拥抱差异化赛道
2021-02-08,中信建投证券策略：今年春节应当持股吗？
